{
  "schema_version": "1.0",
  "week": "2026-W49",
  "task_folder": "2026-December-week1",
  "start": "2026-11-30",
  "end": "2026-12-05",
  "as_of": "2026-10-31",
  "goal": "If go: the first small real-money week. Make S1 react at bar close, and take the probability check's first honest read.",
  "context": [
    "Program: plans/README.md (read first). Every task with a Plan link is written so another agent can pick it up cold.",
    "Rules: DEV first; venv-s1 is read-only (no pip install); no look-ahead; forward ledger untouched; shadow until PC-07; free data only.",
    "This week is deliberately overloaded; agents pick tasks in order of their dependencies."
  ],
  "fixed_dates": [
    {
      "date": "2026-12-04",
      "text": "US jobs report 08:30 New York"
    },
    {
      "date": "2026-12-09",
      "text": "FOMC decision (next week) — intraday scorer must be live"
    }
  ],
  "days": [
    {
      "date": "2026-11-30",
      "theme": "Real money, small",
      "goal": "If W48 said go: live mode on, about $200, watched closely.",
      "plan": "Switch mode by the LR-03 runbook; red LIVE frame visible; owner present.",
      "tasks": [
        {
          "id": "W49-MON-1",
          "system": "ops",
          "status": "todo",
          "title": "If go: switch to live by the runbook (LR-03), confirm the LIVE frame, first-day watch",
          "note": "Owner action"
        }
      ]
    },
    {
      "date": "2026-12-01",
      "theme": "Bar-close — measure",
      "goal": "Know the real delay between bar close and decision.",
      "plan": "Measure 4 weeks of delays; write ADR-006.",
      "tasks": [
        {
          "id": "W49-TUE-1",
          "system": "system-1",
          "status": "todo",
          "title": "ON-01 measure decision delay; ADR-006 bar-close inference design",
          "plan": "plans/ON-01-bar-close-inference.md"
        }
      ]
    },
    {
      "date": "2026-12-02",
      "theme": "Bar-close — build",
      "goal": "S1 reacts at bar close in DEV.",
      "plan": "Flagged trigger with scheduled fallback; start a week of parity.",
      "tasks": [
        {
          "id": "W49-WED-1",
          "system": "system-1",
          "status": "todo",
          "title": "ON-01 bar-close trigger in DEV behind S1_BAR_CLOSE_TRIGGER, parity week starts",
          "plan": "plans/ON-01-bar-close-inference.md"
        }
      ]
    },
    {
      "date": "2026-12-03",
      "theme": "Probability check — first read",
      "goal": "An honest first look, against frozen criteria.",
      "plan": "Produce the review pack; expected answer: stay in shadow, next review date.",
      "tasks": [
        {
          "id": "W49-THU-1",
          "system": "system-1",
          "status": "todo",
          "title": "PC-07 first promotion review pack (criteria frozen; expect stay in shadow)",
          "plan": "plans/PC-07-promotion-review.md"
        }
      ]
    },
    {
      "date": "2026-12-04",
      "theme": "FOMC prep",
      "goal": "The tone strategy is ready for 9 Dec.",
      "plan": "Dry-run the intraday fetch + score on the last statement; check the briefing shows the event.",
      "tasks": [
        {
          "id": "W49-FRI-1",
          "system": "system-1",
          "status": "todo",
          "title": "FOMC 9 Dec dry run: intraday fetch + score + emit path, end to end in DEV"
        }
      ]
    },
    {
      "date": "2026-12-05",
      "theme": "Scorecard",
      "goal": "First live week reviewed honestly.",
      "plan": "Live vs ledger parity, costs, slippage; plan W50.",
      "tasks": [
        {
          "id": "W49-SAT-1",
          "system": "ops",
          "status": "todo",
          "title": "First live week review: fills, slippage, parity; plan 2026-W50"
        },
        {
          "id": "W49-SAT-2",
          "system": "ops",
          "status": "todo",
          "title": "Weekly research job; weekly backup copy to Computer 1"
        }
      ]
    }
  ],
  "decisions": []
}
